[
  {
    "id": "news-quantum-technology-frontier-summit-2026",
    "date": "2026-10-16",
    "dateKind": "event",
    "images": [
      {
        "url": "/assets/quantum-technology-frontier-summit-2026-group.jpg"
      },
      {
        "url": "/assets/quantum-technology-frontier-summit-2026-certificate.jpg"
      }
    ],
    "en": {
      "title": "Professor Yixing Huang Gives an Invited Talk at the 2026 2nd Quantum Technology Frontier Summit",
      "bodyHtml": "<p>On October 16–18, 2026, Professor Yixing Huang, Head of the AIMI Lab, attended the <a href=\"https://www.nmri.ac.cn/index/meeting/custom?id=71\">2026 2nd Quantum Technology Frontier Summit</a> in Hangzhou and delivered an invited talk titled “High-Resolution, High-Bit-Depth Quantum CT Medical Image Reconstruction under Qubit Constraints.”</p>"
    },
    "zh": {
      "title": "黄益星老师参加 2026 第二届量子科技前沿峰会并作邀请报告",
      "bodyHtml": "<p>2026 年 10 月 16—18 日，<a href=\"https://www.nmri.ac.cn/index/meeting/custom?id=71\">2026 第二届量子科技前沿峰会</a>在杭州举行。实验室负责人黄益星老师受邀参会，并作题为“比特限制下的高分辨率高位深量子 CT 医学影像重建”的邀请报告。</p>"
    }
  },
  {
    "id": "news-yixing-huang-teaching-competition-award-2026",
    "images": [
      {
        "url": "/assets/yixing-huang-teaching-competition-award-2026.jpg"
      }
    ],
    "en": {
      "title": "Congratulations to Professor Yixing Huang, Head of the Lab, on Winning Second Prize in the 2026 Young Faculty Teaching Skills Competition of the Peking University Health Science Center Administrative Offices!",
      "bodyHtml": "<p>The Certificate of Honor was issued by the CPC Committee and the Trade Union of the Peking University Health Science Center Administrative Offices. Congratulations to Professor Huang on the recognition of his teaching!</p>"
    },
    "zh": {
      "title": "祝贺实验室负责人黄益星老师荣获医学部机关 2026 年青年教师教学基本功比赛二等奖！",
      "bodyHtml": "<p>荣誉证书由中共北京大学医学部机关委员会、北京大学医学部机关工会颁发，祝贺黄老师的教学工作获得认可！</p>"
    }
  },
  {
    "id": "news-f8282a8",
    "images": [
      {
        "url": "https://pkuaimi.com/wp-content/uploads/2026/09/IMG_5483.jpeg"
      },
      {
        "url": "https://pkuaimi.com/wp-content/uploads/2026/09/IMG_5487.jpeg"
      }
    ],
    "en": {
      "title": "Happy Teachers’ Day!",
      "bodyHtml": "<p>Happy Teachers’ Day! Wishing everyone in our research group success in research and happiness in life!</p>"
    },
    "zh": {
      "title": "祝老师教师节快乐！",
      "bodyHtml": "<p>祝老师教师节快乐！愿课题组全体成员科研硕果累累，生活顺遂如意！</p>"
    }
  },
  {
    "id": "news-6c1a684",
    "images": [
      {
        "url": "https://pkuaimi.com/wp-content/uploads/2026/09/download.png"
      }
    ],
    "en": {
      "title": "Our Paper Receives Acceptance from Physics in Medicine & Biology!",
      "bodyHtml": "<p>The manuscript “Self-Cascade Latent Schrödinger Bridge for CT Field-of-View Extension,” authored by Xihao Wu, Jiacheng Liu, Haijun Yu, Andreas Maier, and Yixing Huang, has been accepted by Physics in Medicine &amp; Biology. The study introduces a self-cascade latent Schrödinger bridge (SCL-SB) that combines a two-round shared-weight cascade with a frequency-aware residual mechanism to recover missing peripheral anatomy in truncated CT images while maintaining efficient inference. Congratulations to all the authors!</p>"
    },
    "zh": {
      "title": "我组论文获《Physics in Medicine & Biology》接收！",
      "bodyHtml": "<p>近日，Xihao Wu、Jiacheng Liu、Haijun Yu、Andreas Maier 和 Yixing Huang 合作完成的论文《Self-Cascade Latent Schrödinger Bridge for CT Field-of-View Extension》获《Physics in Medicine &amp; Biology》接收。该研究提出自级联潜空间薛定谔桥（SCL-SB），结合共享权重的两轮自级联机制与频率感知残差机制，用于恢复截断 CT 中缺失的外周解剖结构，并兼顾解剖细节恢复与推理效率。热烈祝贺各位作者！</p>"
    }
  },
  {
    "id": "news-72fe36f",
    "images": [
      {
        "url": "https://pkuaimi.com/wp-content/uploads/2026/09/%E5%BE%AE%E4%BF%A1%E5%9B%BE%E7%89%87_20260904203359_344_36.jpg"
      }
    ],
    "date": "2026-09-01",
    "dateKind": "event",
    "en": {
      "title": "Welcome PhD Student Ao Wang to Our Team!",
      "bodyHtml": "<p>We are delighted to announce that Ao Wang has officially joined our group as a PhD student on September 1st, 2026. Ao received his master’s degree in Instrument Science and Technology from Chongqing University, and his research will focus on CT reconstruction algorithms. We believe his expertise will further strengthen our efforts in advancing cutting-edge medical imaging technologies. We look forward to his contributions and wish him great success in his doctoral studies!</p>"
    },
    "zh": {
      "title": "欢迎博士新生王奥加入我们课题组！",
      "bodyHtml": "<p>我们很高兴地宣布，王奥于 2026 年 9 月 1 日正式加入我们课题组，成为一名博士研究生。王奥硕士毕业于重庆大学仪器科学与技术专业，研究方向为 CT 重建算法。我们相信他的加入将进一步推动我们在前沿医学成像技术方面的探索，期待他的贡献，并祝愿他在博士阶段取得丰硕成果！</p>"
    }
  },
  {
    "id": "news-ab4e894",
    "images": [
      {
        "url": "https://pkuaimi.com/wp-content/uploads/2026/09/%E5%BE%AE%E4%BF%A1%E5%9B%BE%E7%89%87_20260904210715_402_20.jpg"
      }
    ],
    "date": "2026-09",
    "dateKind": "event",
    "en": {
      "title": "Welcome PhD Student Zuodong Zhong to Our Team!",
      "bodyHtml": "<p>We are delighted to announce that Zuodong Zhong officially joined our group as a PhD student in September 2026. He received his bachelor’s degree from the School of Automation at the University of Science and Technology Beijing. His research interests include long-form medical video understanding and efficient architectures for multimodal large models. We look forward to his contributions and wish him great success in his doctoral studies!</p>"
    },
    "zh": {
      "title": "欢迎博士新生钟祚栋加入我们课题组！",
      "bodyHtml": "<p>我们很高兴地宣布，钟祚栋同学于2026年9月正式加入我们的课题组，攻读博士学位。钟祚栋本科毕业于北京科技大学自动化学院，他的研究方向主要包括医学长视频理解与高效多模态大模型架构。期待他为课题组带来新的探索与贡献，并祝愿他在博士阶段取得丰硕成果！</p>"
    }
  },
  {
    "id": "news-188b580",
    "images": [
      {
        "url": "https://pkuaimi.com/wp-content/uploads/2026/09/%E5%BE%AE%E4%BF%A1%E5%9B%BE%E7%89%87_20260904204944_480_179.jpg"
      }
    ],
    "date": "2026-09-01",
    "dateKind": "event",
    "en": {
      "title": "Welcome Master Student Jiachen Tang to Our Team!",
      "bodyHtml": "<p>We are pleased to welcome Tang Jiachen, who has officially joined our group as a master’s student on September 1st, 2026. She completed her bachelor’s degree at School of Computer Science, Beijing Institute of Technology. During her undergraduate studies, she co-authored a paper on explainable medical image analysis as a co-first author, which was accepted to MICCAI 2025, a top-tier conference in medical imaging, and published. The paper also received a conference award. Her current research will focus on the application of quantum computing combined with artificial intelligence in medical imaging, an emerging and interdisciplinary frontier with great potential. We look forward to her innovative contributions and wish her a fruitful and rewarding graduate journey!</p>"
    },
    "zh": {
      "title": "欢迎硕士新生唐佳晨加入我们课题组！",
      "bodyHtml": "<p>我们很高兴地宣布，唐佳晨于2026年9月1日正式加入本课题组，成为一名硕士研究生。她本科毕业于北京理工大学计算机学院。本科期间，她以共同一作身份发表了一篇可解释性医学影像分析论文，该论文被医学图像领域顶会MICCAI 2025接收并荣获会议奖项。她目前的研究方向为量子计算结合人工智能的医学影像应用，一个有潜力的新兴交叉学科前沿方向。我们期待她的创新性研究，并祝愿她在研究生阶段收获丰硕、前程似锦！</p>"
    }
  },
  {
    "id": "news-cfa55dd",
    "images": [
      {
        "url": "https://pkuaimi.com/wp-content/uploads/2026/08/National_Natural_Science_Foundation_of_China_logo.png"
      }
    ],
    "en": {
      "title": "Congratulations on the successful approval of the NSFC Young Scientists Fund (Category C) Project!",
      "bodyHtml": "<p>Congratulations to Dr. Yu Haijun on the successful approval of the NSFC Young Scientists Fund (Category C) project led by him! The project is titled “Research on Spiral Anode Linear Source Dual-Ring Static CT Imaging.”</p>"
    },
    "zh": {
      "title": "恭喜国自然青C项目顺利获批！",
      "bodyHtml": "<p>恭喜余海军博士负责的国自然青C项目顺利获批！项目名称为“螺旋阳极线源双环静态CT成像研究”！</p>"
    }
  },
  {
    "id": "news-efdea14",
    "images": [
      {
        "url": "https://pkuaimi.com/wp-content/uploads/2026/08/National_Natural_Science_Foundation_of_China_logo.png"
      }
    ],
    "en": {
      "title": "Congratulations on the successful NSFC General Program grant!",
      "bodyHtml": "<p>Congratulations to Professor Huang Yixing on securing the NSFC General Program grant! The project, titled “Quantum Reconstruction of High-Resolution and High-Precision CT Images in Bit-Constrained Environments,” has been officially approved.</p>"
    },
    "zh": {
      "title": "恭喜国自然面上项目顺利获批！",
      "bodyHtml": "<p>恭喜黄益星老师负责的国自然面上项目顺利获批！项目名称为“比特受限环境下的高分辨率高精度CT图像量子重建”！</p>"
    }
  },
  {
    "id": "news-08da1ac",
    "images": [
      {
        "url": "https://pkuaimi.com/wp-content/uploads/2026/08/%E5%B7%A5%E5%AD%A6%E9%99%A2%E5%90%88%E5%BD%B1.jpg"
      },
      {
        "url": "https://pkuaimi.com/wp-content/uploads/2026/08/%E9%BB%84%E7%9B%8A%E6%98%9F_%E5%B7%A5%E5%AD%A6%E9%99%A2%E5%BC%80%E5%AD%A6%E5%85%B8%E7%A4%BC.jpg"
      }
    ],
    "en": {
      "title": "The College of Engineering at Peking University held its 2026 Opening Ceremony and Military Training Kick-off Ceremony",
      "bodyHtml": "<p>Dr. Huang Yixing was invited to attend the <a href=\"https://mp.weixin.qq.com/s/hlmNvxyrOIriY7r3ZGbgvA\" rel=\"noopener noreferrer\">ceremony</a> and delivered a speech as an alumnus representative of the College of Engineering. In his <a href=\"https://mp.weixin.qq.com/s/InjgVQTvtaC7g_A8O7HipQ\" rel=\"noopener noreferrer\">remarks</a>, he reflected on his time as a member of the inaugural undergraduate cohort in Biomedical Engineering, recalling formative experiences such as small-class intensive teaching, an interdisciplinary curriculum, mentorship in undergraduate research, and summer overseas exchange programs. He expressed his gratitude to the School for its meticulous cultivation of students. Drawing on his personal journey, he also shared practical advice with the incoming students on planning their academic paths.</p>"
    },
    "zh": {
      "title": "北京大学工学院2026年开学典礼暨军训开训仪式举行",